[{"schema":"temporality.event/1","event_id":"77b8cf6b3354279504b2d7650f0d67f9/event/000001","occurred_at":"2026-09-25T03:48:44.032442Z","received_at":"2026-09-25T03:48:44.665854Z","source":{"id":"temporality-agent-kernel","integration":"temporality-agent-kernel","version":"0.1"},"context":{"project":"gatekeeper-auth","run":"gatekeeper-20260925-01","actor":{"id":"human-requester","type":"agent"}},"type":"run.started","data":{"parent_run_id":"","role":""}},{"schema":"temporality.event/1","event_id":"d6bfd8bb-39f3-49c0-9144-bc6dc3a01bb7","occurred_at":"2026-09-25T03:48:44.083068Z","received_at":"2026-09-25T03:48:44.083073Z","source":{"id":"temporality-activation","integration":"temporality","version":"1"},"context":{"project":"gatekeeper-auth","run":"gatekeeper-20260925-01","actor":{"id":"human-requester","type":"agent"}},"type":"hint.query"},{"schema":"temporality.event/1","event_id":"77b8cf6b3354279504b2d7650f0d67f9/event/000002","occurred_at":"2026-09-25T03:48:44.095958Z","received_at":"2026-09-25T03:48:44.678195Z","source":{"id":"temporality-agent-kernel","integration":"temporality-agent-kernel","version":"0.1"},"context":{"project":"gatekeeper-auth","run":"gatekeeper-20260925-01","actor":{"id":"human-requester","type":"agent"}},"type":"memory.read"},{"schema":"temporality.event/1","event_id":"77b8cf6b3354279504b2d7650f0d67f9/event/000003","occurred_at":"2026-09-25T03:48:44.103299Z","received_at":"2026-09-25T03:48:44.687805Z","source":{"id":"temporality-agent-kernel","integration":"temporality-agent-kernel","version":"0.1"},"context":{"project":"gatekeeper-auth","run":"gatekeeper-20260925-01","actor":{"id":"human-requester","type":"agent"}},"type":"turn.started"},{"schema":"temporality.event/1","event_id":"77b8cf6b3354279504b2d7650f0d67f9/event/000004","occurred_at":"2026-09-25T03:48:44.1098Z","received_at":"2026-09-25T03:48:44.696242Z","source":{"id":"temporality-agent-kernel","integration":"temporality-agent-kernel","version":"0.1"},"context":{"project":"gatekeeper-auth","run":"gatekeeper-20260925-01","actor":{"id":"human-requester","type":"agent"}},"type":"model.started"},{"schema":"temporality.event/1","event_id":"77b8cf6b3354279504b2d7650f0d67f9/event/000005","occurred_at":"2026-09-25T03:48:56.492298Z","received_at":"2026-09-25T03:48:56.664371Z","source":{"id":"temporality-agent-kernel","integration":"temporality-agent-kernel","version":"0.1"},"context":{"project":"gatekeeper-auth","run":"gatekeeper-20260925-01","actor":{"id":"human-requester","type":"agent"}},"type":"model.completed"},{"schema":"temporality.event/1","event_id":"77b8cf6b3354279504b2d7650f0d67f9/event/000006","occurred_at":"2026-09-25T03:48:56.518149Z","received_at":"2026-09-25T03:48:56.672939Z","source":{"id":"temporality-agent-kernel","integration":"temporality-agent-kernel","version":"0.1"},"context":{"project":"gatekeeper-auth","run":"gatekeeper-20260925-01","actor":{"id":"human-requester","type":"agent"}},"type":"approval.auto_granted","data":{"operation":{"arguments":{"command":["ls","-la"]}},"policy_id":"sandbox.workspace.v1"}},{"schema":"temporality.event/1","event_id":"77b8cf6b3354279504b2d7650f0d67f9/event/000007","occurred_at":"2026-09-25T03:48:56.531299Z","received_at":"2026-09-25T03:48:56.67948Z","source":{"id":"temporality-agent-kernel","integration":"temporality-agent-kernel","version":"0.1"},"context":{"project":"gatekeeper-auth","run":"gatekeeper-20260925-01","actor":{"id":"human-requester","type":"agent"}},"type":"tool.started"},{"schema":"temporality.event/1","event_id":"77b8cf6b3354279504b2d7650f0d67f9/event/000008","occurred_at":"2026-09-25T03:48:57.180162Z","received_at":"2026-09-25T03:48:57.665453Z","source":{"id":"temporality-agent-kernel","integration":"temporality-agent-kernel","version":"0.1"},"context":{"project":"gatekeeper-auth","run":"gatekeeper-20260925-01","actor":{"id":"human-requester","type":"agent"}},"type":"tool.completed"},{"schema":"temporality.event/1","event_id":"77b8cf6b3354279504b2d7650f0d67f9/event/000009","occurred_at":"2026-09-25T03:48:57.192131Z","received_at":"2026-09-25T03:48:57.673233Z","source":{"id":"temporality-agent-kernel","integration":"temporality-agent-kernel","version":"0.1"},"context":{"project":"gatekeeper-auth","run":"gatekeeper-20260925-01","actor":{"id":"human-requester","type":"agent"}},"type":"approval.auto_granted","data":{"operation":{"arguments":{"command":["find",".","-maxdepth","3","-type","f"]}},"policy_id":"sandbox.workspace.v1"}},{"schema":"temporality.event/1","event_id":"77b8cf6b3354279504b2d7650f0d67f9/event/000010","occurred_at":"2026-09-25T03:48:57.21282Z","received_at":"2026-09-25T03:48:57.67881Z","source":{"id":"temporality-agent-kernel","integration":"temporality-agent-kernel","version":"0.1"},"context":{"project":"gatekeeper-auth","run":"gatekeeper-20260925-01","actor":{"id":"human-requester","type":"agent"}},"type":"tool.started"},{"schema":"temporality.event/1","event_id":"77b8cf6b3354279504b2d7650f0d67f9/event/000011","occurred_at":"2026-09-25T03:48:57.493213Z","received_at":"2026-09-25T03:48:57.685094Z","source":{"id":"temporality-agent-kernel","integration":"temporality-agent-kernel","version":"0.1"},"context":{"project":"gatekeeper-auth","run":"gatekeeper-20260925-01","actor":{"id":"human-requester","type":"agent"}},"type":"tool.completed"},{"schema":"temporality.event/1","event_id":"77b8cf6b3354279504b2d7650f0d67f9/event/000012","occurred_at":"2026-09-25T03:48:57.509205Z","received_at":"2026-09-25T03:48:57.690361Z","source":{"id":"temporality-agent-kernel","integration":"temporality-agent-kernel","version":"0.1"},"context":{"project":"gatekeeper-auth","run":"gatekeeper-20260925-01","actor":{"id":"human-requester","type":"agent"}},"type":"turn.completed"},{"schema":"temporality.event/1","event_id":"77b8cf6b3354279504b2d7650f0d67f9/event/000013","occurred_at":"2026-09-25T03:48:57.523297Z","received_at":"2026-09-25T03:48:57.696035Z","source":{"id":"temporality-agent-kernel","integration":"temporality-agent-kernel","version":"0.1"},"context":{"project":"gatekeeper-auth","run":"gatekeeper-20260925-01","actor":{"id":"human-requester","type":"agent"}},"type":"turn.started"},{"schema":"temporality.event/1","event_id":"77b8cf6b3354279504b2d7650f0d67f9/event/000014","occurred_at":"2026-09-25T03:48:57.537463Z","received_at":"2026-09-25T03:48:57.701795Z","source":{"id":"temporality-agent-kernel","integration":"temporality-agent-kernel","version":"0.1"},"context":{"project":"gatekeeper-auth","run":"gatekeeper-20260925-01","actor":{"id":"human-requester","type":"agent"}},"type":"model.started"},{"schema":"temporality.event/1","event_id":"77b8cf6b3354279504b2d7650f0d67f9/event/000015","occurred_at":"2026-09-25T03:49:08.016165Z","received_at":"2026-09-25T03:49:08.664593Z","source":{"id":"temporality-agent-kernel","integration":"temporality-agent-kernel","version":"0.1"},"context":{"project":"gatekeeper-auth","run":"gatekeeper-20260925-01","actor":{"id":"human-requester","type":"agent"}},"type":"model.completed"},{"schema":"temporality.event/1","event_id":"77b8cf6b3354279504b2d7650f0d67f9/event/000016","occurred_at":"2026-09-25T03:49:08.046663Z","received_at":"2026-09-25T03:49:08.684309Z","source":{"id":"temporality-agent-kernel","integration":"temporality-agent-kernel","version":"0.1"},"context":{"project":"gatekeeper-auth","run":"gatekeeper-20260925-01","actor":{"id":"human-requester","type":"agent"}},"type":"approval.auto_granted","data":{"operation":{"arguments":{"command":["cat","README.md"]}},"policy_id":"sandbox.workspace.v1"}},{"schema":"temporality.event/1","event_id":"77b8cf6b3354279504b2d7650f0d67f9/event/000017","occurred_at":"2026-09-25T03:49:08.061658Z","received_at":"2026-09-25T03:49:08.690809Z","source":{"id":"temporality-agent-kernel","integration":"temporality-agent-kernel","version":"0.1"},"context":{"project":"gatekeeper-auth","run":"gatekeeper-20260925-01","actor":{"id":"human-requester","type":"agent"}},"type":"tool.started"},{"schema":"temporality.event/1","event_id":"77b8cf6b3354279504b2d7650f0d67f9/event/000018","occurred_at":"2026-09-25T03:49:08.40113Z","received_at":"2026-09-25T03:49:08.699437Z","source":{"id":"temporality-agent-kernel","integration":"temporality-agent-kernel","version":"0.1"},"context":{"project":"gatekeeper-auth","run":"gatekeeper-20260925-01","actor":{"id":"human-requester","type":"agent"}},"type":"tool.completed"},{"schema":"temporality.event/1","event_id":"77b8cf6b3354279504b2d7650f0d67f9/event/000019","occurred_at":"2026-09-25T03:49:08.408988Z","received_at":"2026-09-25T03:49:08.705129Z","source":{"id":"temporality-agent-kernel","integration":"temporality-agent-kernel","version":"0.1"},"context":{"project":"gatekeeper-auth","run":"gatekeeper-20260925-01","actor":{"id":"human-requester","type":"agent"}},"type":"approval.auto_granted","data":{"operation":{"arguments":{"command":["cat","docs/legacy.md"]}},"policy_id":"sandbox.workspace.v1"}},{"schema":"temporality.event/1","event_id":"77b8cf6b3354279504b2d7650f0d67f9/event/000020","occurred_at":"2026-09-25T03:49:08.416691Z","received_at":"2026-09-25T03:49:08.712774Z","source":{"id":"temporality-agent-kernel","integration":"temporality-agent-kernel","version":"0.1"},"context":{"project":"gatekeeper-auth","run":"gatekeeper-20260925-01","actor":{"id":"human-requester","type":"agent"}},"type":"tool.started"},{"schema":"temporality.event/1","event_id":"77b8cf6b3354279504b2d7650f0d67f9/event/000021","occurred_at":"2026-09-25T03:49:08.659725Z","received_at":"2026-09-25T03:49:08.72057Z","source":{"id":"temporality-agent-kernel","integration":"temporality-agent-kernel","version":"0.1"},"context":{"project":"gatekeeper-auth","run":"gatekeeper-20260925-01","actor":{"id":"human-requester","type":"agent"}},"type":"tool.completed"},{"schema":"temporality.event/1","event_id":"77b8cf6b3354279504b2d7650f0d67f9/event/000022","occurred_at":"2026-09-25T03:49:08.671729Z","received_at":"2026-09-25T03:49:08.729684Z","source":{"id":"temporality-agent-kernel","integration":"temporality-agent-k